{
  "$schema": "../Schemas/machine.schema.json",
  "name": "Night Fever",
  "field": {
    "min": [
      50,
      4
    ],
    "max": [
      270,
      238
    ]
  },
  "walls": [
    [
      152,
      122,
      152,
      131
    ],
    [
      168,
      122,
      168,
      131
    ],
    [
      152,
      131,
      168,
      131
    ],
    [
      95,
      144,
      95,
      153
    ],
    [
      105,
      144,
      105,
      153
    ],
    [
      95,
      153,
      105,
      153
    ],
    [
      215,
      144,
      215,
      153
    ],
    [
      225,
      144,
      225,
      153
    ],
    [
      215,
      153,
      225,
      153
    ],
    [
      142,
      194,
      142,
      204
    ],
    [
      178,
      194,
      178,
      204
    ],
    [
      142,
      204,
      178,
      204
    ],
    [
      128,
      64,
      160,
      54
    ],
    [
      160,
      54,
      192,
      64
    ],
    [
      192,
      64,
      192,
      98
    ],
    [
      192,
      98,
      128,
      98
    ],
    [
      128,
      98,
      128,
      64
    ],
    [
      72.15,
      188.2,
      79.34,
      182.78
    ],
    [
      79.34,
      182.78,
      150,
      232
    ],
    [
      259.69,
      168.49,
      170,
      232
    ],
    [
      244.26,
      51.29,
      225.99,
      53.66
    ]
  ],
  "arcs": [
    {
      "center": [
        160,
        122
      ],
      "radius": 110,
      "from": 217,
      "to": -25,
      "segments": 60
    },
    {
      "center": [
        160,
        122
      ],
      "radius": 101,
      "from": 217,
      "to": 118,
      "segments": 24
    }
  ],
  "nails": {
    "radius": 1,
    "rows": [
      {
        "y": 38,
        "x0": 138,
        "x1": 188.3,
        "spacing": 12
      },
      {
        "y": 50,
        "x0": 120,
        "x1": 210.0,
        "spacing": 12,
        "skip": [
          [
            122,
            198
          ]
        ]
      },
      {
        "y": 62,
        "x0": 102,
        "x1": 223.1,
        "spacing": 12,
        "skip": [
          [
            122,
            198
          ]
        ]
      },
      {
        "y": 74,
        "x0": 96,
        "x1": 232.1,
        "spacing": 12,
        "skip": [
          [
            122,
            198
          ]
        ]
      },
      {
        "y": 86,
        "x0": 90,
        "x1": 238.5,
        "spacing": 12,
        "skip": [
          [
            122,
            198
          ]
        ]
      },
      {
        "y": 98,
        "x0": 84,
        "x1": 242.7,
        "spacing": 12,
        "skip": [
          [
            122,
            198
          ],
          [
            102,
            218
          ]
        ]
      },
      {
        "y": 110,
        "x0": 78,
        "x1": 245.2,
        "spacing": 12,
        "skip": [
          [
            122,
            198
          ],
          [
            102,
            218
          ]
        ]
      },
      {
        "y": 122,
        "x0": 84,
        "x1": 246.0,
        "spacing": 12,
        "skip": [
          [
            102,
            218
          ]
        ]
      },
      {
        "y": 134,
        "x0": 78,
        "x1": 245.2,
        "spacing": 12,
        "skip": [
          [
            102,
            218
          ]
        ]
      },
      {
        "y": 146,
        "x0": 84,
        "x1": 242.7,
        "spacing": 12,
        "skip": [
          [
            90,
            110
          ],
          [
            210,
            230
          ]
        ]
      },
      {
        "y": 158,
        "x0": 90,
        "x1": 238.5,
        "spacing": 12,
        "skip": [
          [
            90,
            110
          ],
          [
            210,
            230
          ]
        ]
      },
      {
        "y": 170,
        "x0": 96,
        "x1": 232.1,
        "spacing": 12
      },
      {
        "y": 182,
        "x0": 102,
        "x1": 223.1,
        "spacing": 12
      },
      {
        "y": 194,
        "x0": 120,
        "x1": 210.0,
        "spacing": 12,
        "skip": [
          [
            138,
            182
          ]
        ]
      }
    ],
    "points": [
      [
        136,
        190
      ],
      [
        184,
        190
      ],
      [
        110.0,
        103.0
      ],
      [
        119.0,
        106.5
      ],
      [
        128.0,
        110.0
      ],
      [
        137.0,
        113.5
      ],
      [
        146.0,
        117.0
      ],
      [
        210.0,
        103.0
      ],
      [
        201.0,
        106.5
      ],
      [
        192.0,
        110.0
      ],
      [
        183.0,
        113.5
      ],
      [
        174.0,
        117.0
      ]
    ]
  },
  "launch": {
    "position": [
      68.63,
      174.75
    ],
    "direction": [
      -0.5,
      -0.866
    ],
    "minSpeed": 400,
    "maxSpeed": 470,
    "perSecond": 1.7,
    "jitter": 0.015
  },
  "pockets": [
    {
      "name": "start",
      "kind": "start",
      "min": [
        153,
        123
      ],
      "max": [
        167,
        130
      ],
      "payout": 3
    },
    {
      "name": "left",
      "kind": "side",
      "min": [
        96,
        145
      ],
      "max": [
        104,
        152
      ],
      "payout": 10
    },
    {
      "name": "right",
      "kind": "side",
      "min": [
        216,
        145
      ],
      "max": [
        224,
        152
      ],
      "payout": 10
    },
    {
      "name": "attacker",
      "kind": "attacker",
      "min": [
        143,
        195
      ],
      "max": [
        177,
        203
      ],
      "payout": 15
    },
    {
      "name": "out",
      "kind": "out",
      "min": [
        148,
        226
      ],
      "max": [
        172,
        238
      ]
    },
    {
      "name": "foul",
      "kind": "foul",
      "min": [
        66,
        180
      ],
      "max": [
        84,
        192
      ]
    }
  ],
  "gate": [
    142,
    194,
    178,
    194
  ],
  "reels": {
    "min": [
      130,
      66
    ],
    "max": [
      190,
      96
    ]
  }
}
